link_properti;nama_properti;alamat;kelurahan;kecamatan;kota;provinsi;jenis_kost;fasilitas_gedung;tipe_kamar;room_area;harga_room_bulanan
https://infokost.id/listing/sarigading-suites/;Sarigading Suites Denpasar Utara Denpasar;Jalan Sari Gading No.14, Tonja, Kec. Denpasar Utara, Kota Denpasar, Bali, 80236;TONJA;DENPASAR UTARA;KOTA DENPASAR;BALI;Kost Campur;Area parkir-CCTV-Dapur-Dispenser-Kulkas-Ruang santai / ruang tamu-Tempat jemur pakaian-Wifi-IPB International-Universitas Bali Internasional-Rumah Sakit Umum Bhakti Rahayu;Suites Room;24;3500000
https://infokost.id/listing/al-isha-home-for-spiritual-travelers/;Al-Isha Home for Spiritual Travelers;Jl. Pura Mertasari No.27 Sunset Road Area Kuta Bali;PEMECUTAN KLOD;DENPASAR BARAT;KOTA DENPASAR;BALI;Kost Campur;Area parkir-CCTV-Cleaning service-Dapur-Kolam renang-Kompor-Laundry-Meja kompor-Rumah Sakit Siloam Denpasar-Trans Studio Mall Bali-Pantai Kuta;Standard - Ground Floor;16;2500000
https://infokost.id/listing/al-isha-home-for-spiritual-travelers/;Al-Isha Home for Spiritual Travelers;Jl. Pura Mertasari No.27 Sunset Road Area Kuta Bali;PEMECUTAN KLOD;DENPASAR BARAT;KOTA DENPASAR;BALI;Kost Campur;Area parkir-CCTV-Cleaning service-Dapur-Kolam renang-Kompor-Laundry-Meja kompor-Rumah Sakit Siloam Denpasar-Trans Studio Mall Bali-Pantai Kuta;Standard - First Floor;16;3000000
https://infokost.id/listing/kost-the-denok-tegal-kertha-denpasar-barat/;Kost The Denok Tegal Kertha Denpasar Barat;Jl. Gunung Bromo No. 11, Tegal Kartha, Kota Denpasar, Bali 80112;TEGAL KERTHA;DENPASAR BARAT;KOTA DENPASAR;BALI;Kost Campur;AC-Area parkir-CCTV-Jendela Menghadap Luar-Wifi-  Supermarket-  Sekolah-  Rumah Sakit-  Rumah Makan-  Mall-  Kampus-  Halte Bus;Standard;24;2500000
https://infokost.id/listing/sthiradhipa-house-denpasar-timur/;Sthiradhipa House Denpasar Timur;;SUMERTA KELOD;DENPASAR TIMUR;KOTA DENPASAR;BALI;Kost Putra;AC-Area parkir-Tempat jemur pakaian-Wifi-Lapangan Niti Mandala Renon-Monumen Bajra Sandhi-Institut Teknologi Dan Bisnis STIKOM BALI-Matahari Duta Mall Plaza-Universitas Udayana-Plaza Renon-Institut Seni Indonesia Denpasar-Pasar Swalayan Tiara Dewata;Regular Single;2;1400000
https://infokost.id/listing/sthiradhipa-house-denpasar-timur/;Sthiradhipa House Denpasar Timur;;SUMERTA KELOD;DENPASAR TIMUR;KOTA DENPASAR;BALI;Kost Putra;AC-Area parkir-Tempat jemur pakaian-Wifi-Lapangan Niti Mandala Renon-Monumen Bajra Sandhi-Institut Teknologi Dan Bisnis STIKOM BALI-Matahari Duta Mall Plaza-Universitas Udayana-Plaza Renon-Institut Seni Indonesia Denpasar-Pasar Swalayan Tiara Dewata;Superior Double;2;1700000
https://infokost.id/listing/pondok-taman-sari-sanur-denpasar-selatan/;Pondok Taman Sari Sanur Denpasar Selatan;;SANUR KAJA;DENPASAR SELATAN;KOTA DENPASAR;BALI;Kost Campur;AC-Area parkir-CCTV-Cleaning service-Dapur-Dispenser-Kompor-Kulkas-Pantai Matahari Terbit Sanur-Pelabuhan SANUR-Museum Le Mayeur-GrandLucky Sanur-McDonald’s Sanur-Pantai Sindhu-Bintang Supermarket-Universitas Warmadewa;Master Queen;6;2000000
https://infokost.id/listing/pondok-taman-sari-sanur-denpasar-selatan/;Pondok Taman Sari Sanur Denpasar Selatan;;SANUR KAJA;DENPASAR SELATAN;KOTA DENPASAR;BALI;Kost Campur;AC-Area parkir-CCTV-Cleaning service-Dapur-Dispenser-Kompor-Kulkas-Pantai Matahari Terbit Sanur-Pelabuhan SANUR-Museum Le Mayeur-GrandLucky Sanur-McDonald’s Sanur-Pantai Sindhu-Bintang Supermarket-Universitas Warmadewa;Executive Queen;19;2500000
https://infokost.id/listing/the-legian-777/;The Legian 777;Jl. Patimura No.49, Legian, Kec. Kuta, Kabupaten Badung, Bali 80361;LEGIAN;KUTA;KABUPATEN BADUNG;BALI;Kost Campur;Area parkir-CCTV-Mesin cuci-Tempat jemur pakaian-Wifi-Tugu Peringatan Bom Bali-Rumah Sakit Siloam Denpasar-Krisna Oleh – Oleh Bali Sunset Road-Mall Bali Galeria ᬫᬮ᭄ᬩᬮᬶᬕᬮᬾᬭᬶᬬ᭟;Double Bed;12;2700000
https://infokost.id/listing/vas-living/;Vas Living;JL. Sekar Tunjung VI no. 28 Denpasar Timur;KESIMAN KERTALANGU;DENPASAR TIMUR;KOTA DENPASAR;BALI;Kost Campur;AC-Area makan-Area parkir-CCTV-Dapur-Jendela Menghadap Luar-Kompor-Kulkas-Universitas Hindu Indonesia-Pasar Batu Bulan Senggol-Indonesian Institute of the Arts, Denpasar;Single bed;15;1500000
https://infokost.id/listing/jimbaran-12-residence/;Jimbaran 12 Residence;Jl. Raya Uluwatu No.1, Jimbaran, Kec. Kuta Sel., Kabupaten Badung, Bali 80361;JIMBARAN;KUTA SELATAN;KABUPATEN BADUNG;BALI;Kost Campur;Area parkir-CCTV-Wifi-Coffe Shop-Warung Makan-Bank-Jimbaran Beach;Standard Room;7;2000000
https://infokost.id/listing/jimbaran-12-residence/;Jimbaran 12 Residence;Jl. Raya Uluwatu No.1, Jimbaran, Kec. Kuta Sel., Kabupaten Badung, Bali 80361;JIMBARAN;KUTA SELATAN;KABUPATEN BADUNG;BALI;Kost Campur;Area parkir-CCTV-Wifi-Coffe Shop-Warung Makan-Bank-Jimbaran Beach;Superior;22;2500000
https://infokost.id/listing/jimbaran-12-residence/;Jimbaran 12 Residence;Jl. Raya Uluwatu No.1, Jimbaran, Kec. Kuta Sel., Kabupaten Badung, Bali 80361;JIMBARAN;KUTA SELATAN;KABUPATEN BADUNG;BALI;Kost Campur;Area parkir-CCTV-Wifi-Coffe Shop-Warung Makan-Bank-Jimbaran Beach;Family Room;22;3000000
https://infokost.id/listing/jimbaran-12-residence/;Jimbaran 12 Residence;Jl. Raya Uluwatu No.1, Jimbaran, Kec. Kuta Sel., Kabupaten Badung, Bali 80361;JIMBARAN;KUTA SELATAN;KABUPATEN BADUNG;BALI;Kost Campur;Area parkir-CCTV-Wifi-Coffe Shop-Warung Makan-Bank-Jimbaran Beach;Deluxe;20;2000000
https://infokost.id/listing/ruoptions-168-residence-denpasar-timur-bali/;168 Residence Denpasar Timur Bali;Jl. Sekar Tunjung XIV No.168, Kesiman Kertalangu, Kec. Denpasar Tim., Kota Denpasar, Bali 80237, Indonesia;KESIMAN KERTALANGU;DENPASAR TIMUR;KOTA DENPASAR;BALI;Kost Campur;Area parkir-Ruang santai / ruang tamu-Universitas Hindu Indonesia 1.6 km-Living World Denpasar 2.6 km-Institut Pariwisata dan Bisnis Internasional 3.4 km-Universitas Bali Internasional 3.9 km-Rumah Sakit Bhayangkara Denpasar 5.1 km-Universitas Warmadewa 5.9 km-Pantai Sanur 9.1 km;Executive Double Regular;21;1450000
https://infokost.id/listing/ruoptions-168-residence-denpasar-timur-bali/;168 Residence Denpasar Timur Bali;Jl. Sekar Tunjung XIV No.168, Kesiman Kertalangu, Kec. Denpasar Tim., Kota Denpasar, Bali 80237, Indonesia;KESIMAN KERTALANGU;DENPASAR TIMUR;KOTA DENPASAR;BALI;Kost Campur;Area parkir-Ruang santai / ruang tamu-Universitas Hindu Indonesia 1.6 km-Living World Denpasar 2.6 km-Institut Pariwisata dan Bisnis Internasional 3.4 km-Universitas Bali Internasional 3.9 km-Rumah Sakit Bhayangkara Denpasar 5.1 km-Universitas Warmadewa 5.9 km-Pantai Sanur 9.1 km;Executive Double Premium;2;1550000
https://infokost.id/listing/ruoptions-168-residence-denpasar-timur-bali/;168 Residence Denpasar Timur Bali;Jl. Sekar Tunjung XIV No.168, Kesiman Kertalangu, Kec. Denpasar Tim., Kota Denpasar, Bali 80237, Indonesia;KESIMAN KERTALANGU;DENPASAR TIMUR;KOTA DENPASAR;BALI;Kost Campur;Area parkir-Ruang santai / ruang tamu-Universitas Hindu Indonesia 1.6 km-Living World Denpasar 2.6 km-Institut Pariwisata dan Bisnis Internasional 3.4 km-Universitas Bali Internasional 3.9 km-Rumah Sakit Bhayangkara Denpasar 5.1 km-Universitas Warmadewa 5.9 km-Pantai Sanur 9.1 km;Family;40;1200000
https://infokost.id/listing/ruoptions-kadessa-pemongan-denpasar-bali/;Kadessa Pemongan Denpasar Bali;Jl. Raya Pemogan No.264, Pemogan, Denpasar Selatan, Kota Denpasar, Bali, Indonesia;PEMOGAN;DENPASAR SELATAN;KOTA DENPASAR;BALI;Kost Campur;Area parkir-CCTV-Dapur-Dispenser-Kompor-Kulkas-Rooftop-Ruang santai / ruang tamu-Upside Down World Bali 0.8 km-LOTTE Wholesale 3.1 km-Mall Bali Galeria 4.4 km-Pelabuhan Benoa Denpasar Selatan 4.5 km-TransMart Carrefour Trans Studio Mall Bali 5 km-Politeknik Kesehatan Denpasar 5.1 km-Bali Wake Park 5.6 km-Bali Exotic Marine Park 5.9 km;Compact Double;9;2000000
https://infokost.id/listing/ruoptions-kadessa-pemongan-denpasar-bali/;Kadessa Pemongan Denpasar Bali;Jl. Raya Pemogan No.264, Pemogan, Denpasar Selatan, Kota Denpasar, Bali, Indonesia;PEMOGAN;DENPASAR SELATAN;KOTA DENPASAR;BALI;Kost Campur;Area parkir-CCTV-Dapur-Dispenser-Kompor-Kulkas-Rooftop-Ruang santai / ruang tamu-Upside Down World Bali 0.8 km-LOTTE Wholesale 3.1 km-Mall Bali Galeria 4.4 km-Pelabuhan Benoa Denpasar Selatan 4.5 km-TransMart Carrefour Trans Studio Mall Bali 5 km-Politeknik Kesehatan Denpasar 5.1 km-Bali Wake Park 5.6 km-Bali Exotic Marine Park 5.9 km;Regular Double;11;2350000
https://infokost.id/listing/shunda-kost-denpasar/;Shunda Kost Denpasar;Jalan Bedahulu VII No.3 Denpasar;DAUH PURI KAJA;DENPASAR UTARA;KOTA DENPASAR;BALI;Kost Campur;Area parkir-CCTV-Dapur-Dispenser-Mesin cuci-Tempat jemur pakaian-Wifi-Institut Pariwisata Dan Bisnis International-Universitas Bali Internasional-Mahendradatta University-Lumintang Park-Rumah Sakit Umum Bhakti Rahayu;Standar;16;1400000
https://infokost.id/listing/shunda-kost-denpasar/;Shunda Kost Denpasar;Jalan Bedahulu VII No.3 Denpasar;DAUH PURI KAJA;DENPASAR UTARA;KOTA DENPASAR;BALI;Kost Campur;Area parkir-CCTV-Dapur-Dispenser-Mesin cuci-Tempat jemur pakaian-Wifi-Institut Pariwisata Dan Bisnis International-Universitas Bali Internasional-Mahendradatta University-Lumintang Park-Rumah Sakit Umum Bhakti Rahayu;Deluxe;16;1800000
https://infokost.id/listing/serenity-2-kost/;Serenity 2 Kost;Jl. Nelayan, Canggu, Kec. Kuta Utara, Kabupaten Badung, Bali 80361;CANGGU;KUTA UTARA;KABUPATEN BADUNG;BALI;Kost Campur;Area parkir-CCTV-Cleaning service-Laundry-Tempat jemur pakaian-Wifi-  Supermarket-  Rumah Sakit-  Rumah Makan;Double Room With Fan, Ac And Private Bathroom;12;5000000
https://infokost.id/listing/kost-putri-akasia/;Kost Putri Akasia;Jl. Akasia XV No.23, Kesiman, Kec. Denpasar Tim., Kota Denpasar, Bali 80237, Indonesia;KESIMAN;DENPASAR TIMUR;KOTA DENPASAR;BALI;Kost Putri;CCTV-Dapur-Kompor-Kulkas-Wifi-Universitas Warmadewa-Wings Futsal-Warung Makan-Super Market;Single Room;12;800000
https://infokost.id/listing/kos-pak-netera/;Kos Pak Netera;Jl. Tukad Badung No.98X, Renon, Denpasar Selatan, Kota Denpasar, Bali 80226, Indonesia;RENON;DENPASAR SELATAN;KOTA DENPASAR;BALI;Kost Campur;Area parkir-Wifi-Universitas Pendidikan Nasional (UNDIKNAS) Denpasar-STMIK Primakara – Cutting Edge IT & Business Campus-Kantor DPRD Provinsi Bali-Renon Victory Futsal;Standard;18;1600000
https://infokost.id/listing/the-purple-kost/;The Purple Kost;Jl. Nusa Indah Gg.XXI no No.3A, Sumerta, East Denpasar, Denpasar City, Bali 80236;SUMERTA;DENPASAR TIMUR;KOTA DENPASAR;BALI;Kost Campur;Area parkir-Dapur-Wifi-Institut Seni Indonesia Denpasar-Universitas Mahasaraswati Denpasar-Politeknik Nasional-Taman Werdhi Budaya Art Centre;Standard;11;1250000
https://infokost.id/listing/kost-ganandra-stay/;Kost Ganandra Stay;Jl. Tantular Bar. No.41, Dangin Puri Klod, Kec. Denpasar Tim., Kota Denpasar, Bali 80210;DANGIN PURI KLOD;DENPASAR TIMUR;KOTA DENPASAR;BALI;Kost Campur;Area parkir-CCTV-Cleaning service-Dapur-Wifi-Bali Royal Hospital-Universitas Udayana, Kampus Sudirman-Kantor DPRD Provinsi Bali-Lapangan Puputan Renon;Standard;13;2550000
https://infokost.id/listing/puri-mas-agung/;Puri Mas Agung;Jl. Bypass Ngurah Rai No.37, Kedonganan, Kec. Kuta, Kabupaten Badung, Bali 80364;KEDONGANAN;KUTA;KABUPATEN BADUNG;BALI;Kost Campur;Area parkir-CCTV-Dapur-Pantai Kedonganan-Benoa Square-SMA NEGERI 2 KUTA-Bandar Udara Internasional Ngurah Rai;Standard;17;3100000
https://infokost.id/listing/matahari-guest-house/;Matahari Guest House;Jl. Dam T. Badung No.6, Dauh Puri Kauh, Kec. Denpasar Bar., Kota Denpasar, Bali 80113, Indonesia;PEMECUTAN KLOD;DENPASAR BARAT;KOTA DENPASAR;BALI;Kost Campur;Area parkir-CCTV-Cleaning service-Wifi-Rumah Sakit Umum Pusat Sanglah-Pasar Tradisional Galang Ayu-Warung Makan-Coffe Shop;Kamar Standard;24;2300000
https://infokost.id/listing/kost-87/;Kost 87;Jl. Tukad Batanghari No.87, Panjer, Denpasar Selatan, Kota Denpasar, Bali 80225, Indonesia;DAUH PURI KLOD;DENPASAR BARAT;KOTA DENPASAR;BALI;Kost Campur;Area parkir-CCTV-Cleaning service-Dapur-Rooftop-STMIK Primakara – Cutting Edge IT & Business Campus-Universitas Pendidikan Nasional (UNDIKNAS) Denpasar-Institut Desain & Bisnis Bali-Monumen Bajra Sandhi;Tipe A;12;2000000
https://infokost.id/listing/kost-pak-tajem/;Kost Pak Tajem;Jalan Sokasati Gang Genjinga No 5, Kel. Kesiman, Kec. Denpasar Timur, Kota Denpasar, Bali;KESIMAN;DENPASAR TIMUR;KOTA DENPASAR;BALI;Kost Campur;CCTV-Kompor-Kulkas-Universitas Warmadewa-Wings Futsal-Universitas Mahasaraswati Denpasar-Taman Werdhi Budaya Art Centre-Institut Seni Indonesia Denpasar;Standard;12;700000
https://infokost.id/listing/kost-np20/;Kost NP20;Jl. Nusa Penida No.20, Dauh Puri Klod, Kec. Denpasar Bar., Kota Denpasar, Bali 80114;DAUH PURI KLOD;DENPASAR BARAT;KOTA DENPASAR;BALI;Kost Campur;Area parkir-Dapur-Laundry-Ruang santai / ruang tamu-Universitas Udayana, Kampus Sudirman-Universitas Bali Dwipa (UBAD)-Rumah Sakit Umum Pusat Sanglah-Rumah Sakit Prima Medika;Tipe A;47;3000000
https://infokost.id/listing/kost-lodge-stay/;Kost Lodge Stay;Jl. Raya Puri Gading E2/20, Jimbaran, Kuta Selatan, Badung, Bali;JIMBARAN;KUTA SELATAN;KABUPATEN BADUNG;BALI;Kost Campur;Area parkir-Dapur-Garuda Wisnu Kencana Cultural Park-Lap. Sepak Bola Cengiling-Politeknik Negeri Bali;Kamar 1 Balcony;91;1250000
https://infokost.id/listing/kost-lodge-stay/;Kost Lodge Stay;Jl. Raya Puri Gading E2/20, Jimbaran, Kuta Selatan, Badung, Bali;JIMBARAN;KUTA SELATAN;KABUPATEN BADUNG;BALI;Kost Campur;Area parkir-Dapur-Garuda Wisnu Kencana Cultural Park-Lap. Sepak Bola Cengiling-Politeknik Negeri Bali;Kamar 2 Balcony;25;1250000
https://infokost.id/listing/kost-lodge-stay/;Kost Lodge Stay;Jl. Raya Puri Gading E2/20, Jimbaran, Kuta Selatan, Badung, Bali;JIMBARAN;KUTA SELATAN;KABUPATEN BADUNG;BALI;Kost Campur;Area parkir-Dapur-Garuda Wisnu Kencana Cultural Park-Lap. Sepak Bola Cengiling-Politeknik Negeri Bali;Kamar 3 Basic;48;1250000
https://infokost.id/listing/kubu-gdk-pertiwi/;Kubu GDK Pertiwi;Jalan Bunut Sari Gg.Pura Uluwatu 3 No.4,Legian Kelod-Kuta.;LEGIAN;KUTA;KABUPATEN BADUNG;BALI;Kost Campur;Area parkir-CCTV-Cleaning service-Dispenser-Kompor-Kulkas-Mesin cuci-Microwave-Pantai Kuta Bali-Krisna Oleh – Oleh Bali Sunset Road-TRANS STUDIO MALL BALI-Puskesmas;Standard;35;2800000
https://infokost.id/listing/kubu-gdk-pertiwi/;Kubu GDK Pertiwi;Jalan Bunut Sari Gg.Pura Uluwatu 3 No.4,Legian Kelod-Kuta.;LEGIAN;KUTA;KABUPATEN BADUNG;BALI;Kost Campur;Area parkir-CCTV-Cleaning service-Dispenser-Kompor-Kulkas-Mesin cuci-Microwave-Pantai Kuta Bali-Krisna Oleh – Oleh Bali Sunset Road-TRANS STUDIO MALL BALI-Puskesmas;Family;45;3200000
https://infokost.id/listing/chendana-homestay/;Chendana Homestay;Jl. Hang Tuah No.10, Renon, Denpasar Selatan, Kota Denpasar, Bali 80239;RENON;DENPASAR SELATAN;KOTA DENPASAR;BALI;Kost Campur;Area parkir-CCTV-Rooftop-Wifi-Monumen Bajra Sandhi-Matahari Terbit Beach Sanur-Udayana Golf Driving Range-Gandhi Memorial International School-Plaza Renon;Standard;12;3500000
https://infokost.id/listing/tantular-residence/;Tantular Residence;Jl. Tantular I No.2, Dangin Puri Klod, Kec. Denpasar Tim., Kota Denpasar, Bali 80234;DANGIN PURI KLOD;DENPASAR TIMUR;KOTA DENPASAR;BALI;Kost Campur;Area parkir-CCTV-Monumen Bajra Sandhi-Bank-Warung Makan-Coffe Shop-Universitas Udayana, Kampus Sudirman-Bali Royal Hospital;Standard Room;4;2000000
https://infokost.id/listing/kost-a8/;Kost A8;Jl. Pura Demak No.8, Pemecutan Klod, Kec. Denpasar Bar., Kota Denpasar, Bali 80119, Indonesia;UNGASAN;KUTA SELATAN;KABUPATEN BADUNG;BALI;Kost Campur;Area parkir-CCTV-Cleaning service-Dapur-Kolam renang-Laundry-Rooftop-Ruang santai / ruang tamu-Garuda Wisnu Kencana Cultural Park-SMA Negeri 1 Kuta Selatan-Super Market;Kamar #3, #4, #7, #9, #10, #11;12;1800000
https://infokost.id/listing/kost-a8/;Kost A8;Jl. Pura Demak No.8, Pemecutan Klod, Kec. Denpasar Bar., Kota Denpasar, Bali 80119, Indonesia;UNGASAN;KUTA SELATAN;KABUPATEN BADUNG;BALI;Kost Campur;Area parkir-CCTV-Cleaning service-Dapur-Kolam renang-Laundry-Rooftop-Ruang santai / ruang tamu-Garuda Wisnu Kencana Cultural Park-SMA Negeri 1 Kuta Selatan-Super Market;Kamar #5 - Economy Size;9;1400000
https://infokost.id/listing/taman-griya-residence/;Taman Griya Residence;Jl. Wonosari Kidul No.9, Sawunggaling, Kec. Wonokromo, Kota SBY, Jawa Timur 60242;JIMBARAN;KUTA SELATAN;KABUPATEN BADUNG;BALI;Kost Campur;Area parkir-CCTV-Cleaning service-Dapur-Laundry-Rooftop-Ruang santai / ruang tamu-Wifi-Bank-Warung Makan-Coffe Shop-Rumah Sakit Umum Bali Jimbaran-Super Market-Apotek-SPBU;Type Reguler;9;2000000
https://infokost.id/listing/taman-griya-residence/;Taman Griya Residence;Jl. Wonosari Kidul No.9, Sawunggaling, Kec. Wonokromo, Kota SBY, Jawa Timur 60242;JIMBARAN;KUTA SELATAN;KABUPATEN BADUNG;BALI;Kost Campur;Area parkir-CCTV-Cleaning service-Dapur-Laundry-Rooftop-Ruang santai / ruang tamu-Wifi-Bank-Warung Makan-Coffe Shop-Rumah Sakit Umum Bali Jimbaran-Super Market-Apotek-SPBU;Type Large;16;2200000
